<!ELEMENT lista (pedido*)>
    <!ELEMENT pedido (numSerie,cantidad,peso?)>
    <!ELEMENT numSerie (#PCDATA)>
    <!ELEMENT cantidad (#PCDATA)>
    <!ELEMENT peso (#PCDATA)>